user_id,app_id,usage_minutes,rating,timestamp,review
140,23,253,4.6,2025-11-22 18:33:19.754764,"I love this app. I've been using more than 2 months Easy to use. now the performance is faster and more stable. The lag used to be a real issue, it was extremely laggy. Although you still can't use it while syncing it completely freezes until that's done. I've used Keep on my laptop and now on my phone as well. You'd stop an entry, wait several seconds, which made the app a pain. Not to mention being unable to use the app when it's syncing because its literally stop responding until it's done."
140,59,401,5.0,2025-11-24 23:33:19.754764,very helpful to read news headlines
140,96,409,5.0,2025-11-26 04:33:19.754764,This is a very useful app
141,79,21,1.7,2025-11-07 21:33:19.754764,it's amazing please download and try at least once
141,30,58,2.4,2025-11-11 01:33:19.754764,it's worthy
141,91,128,3.7,2025-11-12 03:33:19.754764,PyCode more easiee than this but this is work
141,38,179,3.1,2025-11-14 08:33:19.754764,"Beginner-friendly, structured courses aligned with industry needs."
141,25,289,4.9,2025-11-16 12:33:19.754764,advisor call nhi uthate aur nahi karte kitna bhi request karo
141,1,300,4.5,2025-11-17 15:33:19.754764,good editor
141,16,224,4.5,2025-11-20 17:33:19.754764,I am in middle east but I use app in English why Coursera force me to use Arabic language and try sooo many times to change it with no change ?
142,8,35,2.3,2025-11-11 21:33:19.754764,rost man 7 star
142,67,72,2.1,2025-11-13 22:33:19.754764,"Decentish app, but the amount of bots in this app is insane. Not sufficient enough online players honestly."
142,39,141,3.4,2025-11-17 03:33:19.754764,very nice app l like this
142,73,187,3.1,2025-11-18 06:33:19.754764,Duolingo is a great learning app you can also use it for free without pro features
142,93,201,4.8,2025-11-19 10:33:19.754764,I think this suits better for Samsung.
142,87,177,3.4,2025-11-20 15:33:19.754764,Detailed explanation of every concept.I highly recommend this app for learning
142,41,340,5.0,2025-11-21 16:33:19.754764,"Cham has been amazing and patient, very professional, adapting and changing plans to my needs , very happy thx"
143,44,53,2.7,2025-11-07 21:33:19.754764,very good job search aap
143,62,49,2.4,2025-11-10 23:33:19.754764,This news channel covers many topics and provides detailed information.
143,94,84,2.8,2025-11-12 00:33:19.754764,good for me.
143,68,96,2.7,2025-11-14 04:33:19.754764,thank you for build this app
143,40,224,4.8,2025-11-15 09:33:19.754764,the system and very friendly and helps me a lot
144,69,22,1.2,2025-11-08 21:33:19.754764,Teachers are very helpful
144,41,64,2.5,2025-11-12 02:33:19.754764,my guy was great..did a fast and professional Job. I would recommend him to anyone.
144,99,103,3.3,2025-11-14 05:33:19.754764,Awesome Coding App For Fast learner
144,57,197,3.1,2025-11-16 10:33:19.754764,news is 5 hours to 5 days old AP or Reuter is way better and you get constant news updates. Google News stays 5 hours behind and way longer
144,86,183,3.2,2025-11-18 11:33:19.754764,really good
144,16,363,5.0,2025-11-19 16:33:19.754764,help support was good but then I was approved for a full course through financial then after I did almost half the course there computer messed up shut me out and instead of making it right the said if you want course certificate you got to pay for the course now.hundreds of people complaining on reddit.
145,26,66,2.2,2025-11-08 21:33:19.754764,good support for studies
145,92,64,2.6,2025-11-12 01:33:19.754764,this app was good for beginners but gets difficult for large projects. they charge money for things we can get for free on pc . reducing rating to 3 star .
145,98,99,2.8,2025-11-14 03:33:19.754764,used several coding app. RN this one is best.
145,86,159,3.8,2025-11-16 07:33:19.754764,it's good and easy to use
145,69,112,3.2,2025-11-18 11:33:19.754764,vary helpfull thank you.
145,11,247,4.6,2025-11-20 13:33:19.754764,Latest update changed the aqua highlight so it no longer shows up in dark mode. Please fix this!! I need to read in dark mode and now can't see many of my highlights.
146,72,46,2.6,2025-11-08 21:33:19.754764,Fun and challenging. It gives me and my daughter's good quality time while learning
146,84,80,2.4,2025-11-11 23:33:19.754764,The course is easy to understand and keeps you interested.
146,10,139,3.7,2025-11-13 04:33:19.754764,nice one for new writers and readers. it's provide many languages and also translating some premium stories to multi languages. the only problem is can't get notifications on time .
146,39,106,3.8,2025-11-16 06:33:19.754764,iam thanks full to this app and very useful app and don't waste your time please download this app and enjoy
147,60,7,1.6,2025-11-10 21:33:19.754764,too much ads
147,42,56,2.3,2025-11-13 00:33:19.754764,I love glasadoor service
147,72,127,3.2,2025-11-16 01:33:19.754764,"I wanted to enjoy this game, as it stimulates the mind. Gameplay is both relaxing and forces me to pay attention - yeah, I like 'rithmetic, I'm weird, okay? Then the ads started. At first it was tolerable, but quickly escalated to having an ad thrown in my face after EVERY SINGLE LEVEL. These weren't just simple ads that I could exit (after a timer) and resume play: oh no, I was forced into the app store every time. By the time I returned to the game and started ... stupid character limits"
147,13,221,4.3,2025-11-18 05:33:19.754764,whenever I try to open any book to read the app always shows internet connection error despite having good range and WiFi
147,57,221,4.9,2025-11-20 08:33:19.754764,The news feeds are good . News related to South Asian development are missing.
147,23,290,4.6,2025-11-23 11:33:19.754764,best place to study
147,40,167,3.8,2025-11-25 13:33:19.754764,Easily found an expert to help build my dream. Azam is the best!
147,52,238,4.3,2025-11-26 18:33:19.754764,ordered air purifier.. received a non working product and from last 15-20 days tracking them but not getting any response and refund
148,81,57,2.2,2025-11-09 21:33:19.754764,reading skill and mere ko hindi padne main dikkat hoti thi kyunki main English midium padhai ki thi . I LIKE READ ALONG
148,41,64,2.9,2025-11-12 00:33:19.754764,overall its great opportunity for someone who wants to earn online. But I would suggest add the field of optometry as well.
148,92,68,2.1,2025-11-13 02:33:19.754764,interpreter mode shows program finished glitch in android 15 but its work in other lower android version
148,49,87,2.6,2025-11-16 06:33:19.754764,super fast service
148,52,268,4.5,2025-11-18 11:33:19.754764,5 days since ordered lifesaving medicine not delivered yet... uninstalling... dont need such unreliable service it increases my bp.... i will use 1mg atleast when they say 2 days they deliver.. medicine can save lives your delays and saying medicine not available after 3 days is criminal... if you cant do this service seriously and professionally close your company... Someone can lose their life waiting and stressing for a medicine... if medicine not available tell during order so we can order.
148,56,241,4.2,2025-11-21 15:33:19.754764,such a third class apps becoming nowadays for money. I have been using this since ten years and today all my net data of 1.5GB emptied within five minutes when I just opened app to read news. then I came to notice that one bloody vedio which is unstoppable has taken all data. my question to dialy hunt that how come allow such video players to play without your permission.?? or else you only allowed them to empty users data for money. being a journalist you should have minimum ethics.
148,70,263,4.5,2025-11-22 20:33:19.754764,outstanding performance of the app I am very satisfied with this app
148,28,178,3.6,2025-11-26 01:33:19.754764,Previous videos are playing in Background. While watching the video which I watched earlier sound also starts coming with current video. Please solve this then i will give 5 star bcoz other things about the app is very nice
149,11,49,2.8,2025-11-11 21:33:19.754764,a great source of entertainment at a low cost.
149,19,85,2.6,2025-11-13 01:33:19.754764,"You should improve your app. It feels like lagging or not working properly. Like when coming back from a page to last page some time it responds slow or very slow. So , work on the app improvement."
149,94,102,3.7,2025-11-15 06:33:19.754764,simple to use.
149,68,221,4.4,2025-11-17 11:33:19.754764,"This app is so good, no matter which grade you are in! Would recommend this app to anyone who wants to get better at maths! 10/10 if you would ask me :)"
149,97,120,3.8,2025-11-19 14:33:19.754764,Made me very easier ..
149,36,151,3.5,2025-11-22 19:33:19.754764,"Work India is a good job-providing app, but some people ask for money before giving a job, saying you have to pay 3000 rupees upfront for a uniform. When we say we don't have the money, they tell us to borrow it from someone."
149,60,295,4.7,2025-11-25 20:33:19.754764,Not Working Properly after update
150,65,16,1.2,2025-11-07 21:33:19.754764,satisfied English news presentation
150,10,98,2.6,2025-11-08 22:33:19.754764,intresting story
150,36,93,2.7,2025-11-12 02:33:19.754764,"I m not getting better job..all are insurance.delivery , job ."
150,33,109,3.9,2025-11-14 04:33:19.754764,best trading app
151,99,28,2.7,2025-11-09 21:33:19.754764,It's good and helpful to all ICT students
151,50,76,2.2,2025-11-11 00:33:19.754764,easy to use
151,31,145,3.4,2025-11-13 03:33:19.754764,my account is not login
151,85,119,3.8,2025-11-15 07:33:19.754764,This is the correct application for the beginners who want to learn the c language
151,57,214,4.5,2025-11-17 11:33:19.754764,c waste of my time
151,93,280,4.8,2025-11-18 16:33:19.754764,"Something new is that's, does ""for loop"" command in the html window, doesn't nothing even with run code program. Please fix this"
151,82,251,4.7,2025-11-21 19:33:19.754764,"best learning app ever made.even you can learn anytime,anywhere at any choice of your course for tech and non tech roles"
152,99,54,2.7,2025-11-09 21:33:19.754764,"Can't do course - bottom of the course window gets cut off on Samsung Fold 7 big inner screen and I can't select an answer so I can't click on the check button to continue. Please optimize app for Samsung Fold 7 big inner screen so that people with Samsung Galaxy Z Fold 7 phone can actually use your app you charge $85 a year for. I started a trial and subscribed, will cancel if this is not fixed by end of trial (don't want to throw money away for app I can't use on my Samsung Fold 7 phone)."
152,87,46,2.2,2025-11-12 02:33:19.754764,The auto rotate screen is not working properly if you use landscape mode then it's not coming back in portrait mode
152,96,113,3.3,2025-11-13 07:33:19.754764,good but not running the code
152,31,84,2.2,2025-11-15 09:33:19.754764,not working properly chart are not opening
152,94,281,4.7,2025-11-18 11:33:19.754764,best for practice
152,76,249,4.7,2025-11-19 16:33:19.754764,helps a lot for school
152,25,238,4.3,2025-11-20 17:33:19.754764,best learning platform
153,89,57,2.7,2025-11-09 21:33:19.754764,I'm loving it
153,86,69,2.8,2025-11-12 00:33:19.754764,perfect and beneficial app for your future
153,99,114,3.4,2025-11-14 01:33:19.754764,very good for beginners
153,42,181,3.6,2025-11-15 03:33:19.754764,"For the first time ever I tried too leave a review for my x-company... However, it never gets published despite using very professional language! I believe glassdoor allows companies to influence what is being said about them on their website and app."
153,33,96,2.2,2025-11-17 06:33:19.754764,meta Trade 5 is Excellent I like and love it
153,21,260,4.6,2025-11-19 10:33:19.754764,worst teachers are there. seems like they're not interested at all. almost all teachers know hindi language only and teaching that only. no timing batches.
154,90,60,2.4,2025-11-07 21:33:19.754764,"free and little ads, and infinite compiles, literally perfect"
154,43,74,2.7,2025-11-10 23:33:19.754764,salary very low
154,51,173,3.9,2025-11-13 00:33:19.754764,fast delivery
154,74,114,3.9,2025-11-16 03:33:19.754764,its a scam frst said only pay 3 ruppes and the its auto debit 299 its a very big scam dont download alll its ver ver very worst experience and its not fot for u alll very bad experience and worst app ... i have to pay 299 rs per month
154,1,200,3.8,2025-11-17 06:33:19.754764,never uploads pictures for ai to edit
154,66,287,4.9,2025-11-20 08:33:19.754764,The perfect Math App to solve my mathematical equations for my assignments. 100% recommend
155,81,13,1.2,2025-11-06 21:33:19.754764,nice not good not bad
155,89,77,2.7,2025-11-09 23:33:19.754764,nice for me
155,46,71,2.4,2025-11-12 04:33:19.754764,Nice to see the review.
155,63,112,3.7,2025-11-15 05:33:19.754764,bina jaach ka news
155,11,263,4.7,2025-11-18 09:33:19.754764,"I love my kindle. It makes reading so easy and lightweight. I still enjoy the actual flipping of a page, but the convenience of my kindle is undeniable. I can pop it in my purse and its my boredom killer if ever I am in a situation where I have to wait for someone or an appointment, or when I'm travelling. Its great and I can load so many books onto it. Highly recommend."
155,57,207,4.6,2025-11-19 10:33:19.754764,very good app
155,95,183,3.2,2025-11-22 11:33:19.754764,Momo is awesome and incredible.
156,22,41,2.7,2025-11-10 21:33:19.754764,"They advertise that they provide short tricks but actually do not give any. These are short lectures only and that too not complete. The Course named ""Coordinate Geometry"" has only initial portions of straight lines and nothing else but still costs 900 rs."
156,76,68,2.6,2025-11-13 01:33:19.754764,this app is amazing!!!!
156,9,110,3.2,2025-11-15 03:33:19.754764,Best animation app ever
156,14,152,3.7,2025-11-16 06:33:19.754764,"I love the books on this app. However, this app gives you very few opportunities to acquire the points to open the next chapter. It allows you two times a day to watch 2 adds that will open a chapter. The book I just started has over 800 chapters that cost over 20 points, or coins, to open. The cost for the coins is not worth the price it would cost me to read this book. It will take me too long to read the book I'm currently reading for free."
156,15,244,4.2,2025-11-17 10:33:19.754764,this app is the best for tracking and sharing your reading history.
156,64,199,3.8,2025-11-20 14:33:19.754764,Easy to assess in free of cost.
156,77,183,3.6,2025-11-21 15:33:19.754764,been a user for 4 years and made a good friend from here. I even teach English sometimes
157,19,56,2.2,2025-11-07 21:33:19.754764,"When I open the app automatically logout my account. again I want login to apply for jobs. App Automatically logout my account, Every 5 Seconds Once."
157,82,115,3.9,2025-11-10 23:33:19.754764,awesome app
157,35,83,2.3,2025-11-13 02:33:19.754764,these app makes things earlier to search for a job
157,67,195,3.7,2025-11-16 03:33:19.754764,"please fix the bug in blitz and classic mode. it's annoying how I'm losing in spite of knowing the answers, because for some reason app just stands frozen."
157,58,310,5.0,2025-11-17 07:33:19.754764,for better knowledge right way to grow lifetime understand with my world
158,20,11,1.6,2025-11-06 21:33:19.754764,It is very helpful.
158,88,76,2.7,2025-11-08 01:33:19.754764,this app is great I like it.it make app and games very perfect
158,61,81,2.5,2025-11-10 02:33:19.754764,"USELESS! DONT BUY!! Once you pay premium you loose everything, you are diverted to other premium paid pages. you wont get any fresh news, but only Old expired news. feeling completely cheated."
158,64,115,3.8,2025-11-11 06:33:19.754764,good news providing
158,23,210,4.7,2025-11-14 11:33:19.754764,test are very good but mobile interface is too much bad analysing section is not good also a separate portion should be made for analysing user performance and his level compare to others like in PW app
159,13,29,2.6,2025-11-07 21:33:19.754764,This is quite literally the best audiobook app! I would appreciate it more if they were able to get the complete books in series instead of just a few parts
159,31,86,2.2,2025-11-09 23:33:19.754764,UPSTOX-STOCKS & DEM... GOOD APP
159,95,130,3.4,2025-11-11 03:33:19.754764,Great Way to Learn Python
159,53,96,2.6,2025-11-12 06:33:19.754764,very good service & fast service
159,26,238,4.2,2025-11-13 07:33:19.754764,vedantu very good so useful
159,49,213,4.7,2025-11-14 10:33:19.754764,very useless app
160,12,40,2.4,2025-11-07 21:33:19.754764,I love having so many different books right on my phone. I drive A LOT for work and having Audible has been a life saver! I especially love the s dramatized adaptations! more than worth it to have the membership with so many free titles.
160,53,91,2.8,2025-11-09 00:33:19.754764,no home delivery. all medicines not available
160,67,71,2.9,2025-11-12 01:33:19.754764,"please fix the bug in blitz and classic mode. it's annoying how I'm losing in spite of knowing the answers, because for some reason app just stands frozen."
160,63,183,3.7,2025-11-13 05:33:19.754764,"FALSE NEWS IS PROPAGATED ABOUT JSSC CGL EXAM PAPER LEAK . WITHOUT ANY CONFIRMATION OF CID, PRINT MEDIA OF HINDUSTAN TIMES RANCHI SAID ABOUT THE LEAK . AS THIS EXAM IS VERY IMPORTANT FOR ALL JSSC CGL SELECTED CANDIDATES,SO THE INFORMATION WITHOUT ANY CONCLUSIVE EVIDENCE MAY HAMPER THE CASE. SO IT WILL ALSO DECREASE THE CREDIBILITY OF THIS NEWS CHANNEL ."
160,28,173,3.5,2025-11-14 09:33:19.754764,good for beginners
160,76,164,3.3,2025-11-17 13:33:19.754764,it is a really good app and the teachers are awesome
160,61,281,4.7,2025-11-18 17:33:19.754764,Good .............
160,60,272,4.7,2025-11-20 21:33:19.754764,super really news
161,10,42,2.4,2025-11-11 21:33:19.754764,bhut hi acha hai
161,50,115,3.3,2025-11-15 02:33:19.754764,very bad app open problem
161,89,83,2.9,2025-11-16 07:33:19.754764,I'm a beginner and this is very helpful
161,43,167,3.6,2025-11-17 08:33:19.754764,waste of time this job .
162,9,30,2.9,2025-11-11 21:33:19.754764,I love it but it says on my android 13 that my Google account doesn't exist even tho I'm on it on my other phone that is android 15
162,72,92,2.4,2025-11-14 23:33:19.754764,"Too many ads. I understand you have to get paid, but having to push through ad after ad is tiring. Having an ad after first opening, before even playing is bad."
162,91,65,2.4,2025-11-18 03:33:19.754764,best coading app for android
162,27,129,3.7,2025-11-20 08:33:19.754764,1 of the good work done by government
162,18,275,4.7,2025-11-23 11:33:19.754764,Great as its name is.
162,43,142,3.8,2025-11-24 15:33:19.754764,fake app hai ya koi download mat kro koi job nhi mila gi esma
162,31,235,4.7,2025-11-25 16:33:19.754764,"Scammers and Cheaters. Told me I would get lifetime Free AMC and lifetime Free equity delivery. But now they have started charging me both. Seems like I am in a new lifetime now. You should understand the meaning of ""Lifetime"""
162,70,453,5.0,2025-11-26 18:33:19.754764,It asks for subscribtion again and again after every course
163,45,7,1.1,2025-11-09 21:33:19.754764,very bad experience don't time vest ese achha sarkari nokari jaldi mil jayegi HR respons very bad
163,54,93,2.6,2025-11-13 00:33:19.754764,easy to use
163,57,169,3.5,2025-11-15 04:33:19.754764,great and excitin
163,95,130,3.7,2025-11-17 09:33:19.754764,"Mimo is the Best For Beginners and also User Friendly, You could literally learn any language you want. Thank you Mimo"
163,83,114,3.4,2025-11-19 12:33:19.754764,This app is so much helpful for me.even after graduation i was unable to recall the code but after everyday practicing with thjis app i learnt everything and remembered also
164,69,49,2.3,2025-11-11 21:33:19.754764,ye bahut badhia app hai aur is per apne apne bete ya beti ko app bhi befikar ho kar padha sakte ho
164,37,64,2.4,2025-11-14 02:33:19.754764,customer care girl have a wonderful taking skills
164,24,133,3.2,2025-11-17 03:33:19.754764,"Please ,can you tell me how to get 100% in class"
164,23,154,3.8,2025-11-20 05:33:19.754764,Very Helpful for asparients
164,91,193,3.1,2025-11-22 07:33:19.754764,Nice App I love it
165,97,44,2.5,2025-11-08 21:33:19.754764,the app is very interesting.. like a computer..
165,74,46,2.4,2025-11-10 02:33:19.754764,I'm like this app this is so beautiful
165,86,86,2.6,2025-11-12 05:33:19.754764,its great for learning coding
165,19,131,3.1,2025-11-15 10:33:19.754764,"Don't waste time here. I have never seen such a useless app. I'm surprised that it even has a proper infrastructure. It takes 72 hours for verification (even after following the said process) But even after that time passes, nothing gets resolved. Disgusting -Very limited so called key words search. I can't even add my previous job if you don't get logo of you. So it can limit your work exp.Keeps asking for the same information repeatedly,unnecessarily dragging out the profile-filling process."
165,73,218,4.5,2025-11-17 11:33:19.754764,"Used to be a good app but even in the 10 months I've used it more and more is being put behind a paywall. recently 'energy' has been introduced as another attempt to force you to only use the app if you pay, and it's working because I find myself being forced to quit mid-lesson constantly as my 'energy' has run out and I have to pay money or do other things to get some back to finish the lesson. Then they slowly remove the free options of doing so. All of this on an app that already has ads..."
165,94,192,3.8,2025-11-18 14:33:19.754764,Who don't have laptop for coding practice it is helpful to practice it in android phone
165,57,239,4.4,2025-11-20 17:33:19.754764,"Too many ads, between the news interrupting.."
166,57,69,2.8,2025-11-11 21:33:19.754764,Everything you need to see in one location.
166,95,40,2.3,2025-11-15 02:33:19.754764,still exploring
166,54,127,3.1,2025-11-17 03:33:19.754764,it's very useful and it's so discount and delivery is also very fast thank you
166,37,190,3.7,2025-11-19 07:33:19.754764,everything works but after recent update app become slow and job Posting is not loading properly.
166,21,193,3.5,2025-11-20 09:33:19.754764,go for self study instead of buying any course from them.
167,95,45,2.6,2025-11-10 21:33:19.754764,"Amazing apps, helpful"
167,60,72,2.8,2025-11-14 00:33:19.754764,"Lokal Jobs is a fantastic platform! I found the perfect candidates without the usual hiring hassle. The prices are affordable, and the post-service support was also very good. A reliable solution for businesses looking to hire!"
167,29,96,2.9,2025-11-15 01:33:19.754764,super and best app
167,4,205,4.4,2025-11-18 04:33:19.754764,super duper
167,1,163,3.5,2025-11-21 08:33:19.754764,Best of the best app
167,20,296,4.2,2025-11-22 11:33:19.754764,so sorry to tell this app is a amazing for learning I gave 10/5
167,34,203,4.3,2025-11-25 13:33:19.754764,amezing app
168,38,56,2.6,2025-11-08 21:33:19.754764,good app for company exposure
168,68,101,3.4,2025-11-11 23:33:19.754764,good for learning
168,82,132,3.4,2025-11-14 02:33:19.754764,best app to learn.
168,10,158,3.7,2025-11-15 04:33:19.754764,very good story's
169,20,69,2.7,2025-11-07 21:33:19.754764,A simple way to understand animation
169,65,84,2.5,2025-11-11 02:33:19.754764,i will give 5 Star just add dark mode feature 4 star for rajdeep and changaapa
169,29,112,3.3,2025-11-12 04:33:19.754764,"The support team does not respond to our queries, and even when we get on a call with them, they do not provide proper answers."
169,25,221,4.9,2025-11-13 08:33:19.754764,advisor call nhi uthate aur nahi karte kitna bhi request karo
170,16,18,1.1,2025-11-11 21:33:19.754764,"I paid for the annual Pro subscription (was $499, got a black Friday deal for $199) to be able to take Google's 6mo Project Management course and it's been great. I absolutely LOVE the lesson and assignment interface. Super easy and intuitive to navigate."
170,29,73,2.1,2025-11-13 01:33:19.754764,brokerage is high
170,17,65,2.7,2025-11-15 02:33:19.754764,is not working the google login
170,89,140,3.3,2025-11-18 03:33:19.754764,"too fragmented & too slow in progress, too much water"
171,78,11,1.1,2025-11-06 21:33:19.754764,"the app crashed and stopped working. It was the worst experience, aver"
171,27,79,2.5,2025-11-10 00:33:19.754764,"worst app, ignou's maths course has no videos of chapters or aren't loading. English at the Workplace course only has pdf files no videos."
171,76,146,3.2,2025-11-13 02:33:19.754764,"love this i hope the more advanced stuff isn't gatekeeper behind a paywall, cuz this seems like a very wholesome app made to simply help ppl reach their goals of helping ppl learn new languages honestly I wouldn't mind if the made it free and spammed me with ads so I can just learn."
171,26,139,3.3,2025-11-14 07:33:19.754764,user friendly app with free sample papers and board exam papers and revision notes
172,65,49,2.5,2025-11-07 21:33:19.754764,morning start with it....
172,91,77,2.5,2025-11-09 00:33:19.754764,Perfect. Waiting for some stability updates
172,61,108,3.5,2025-11-10 03:33:19.754764,excellent timely news about the news
172,47,103,3.4,2025-11-12 06:33:19.754764,"This app and Seek itself is rather stupid. It gives you notifications for jobs which are no fit for your CV at all. You can not refine advertised jobs and notifications either. There's no option to NOT show jobs below a certain hourly rate, jobs advertised by recruitment agencies, jobs from unwanted companies, ... It's a complete mess! There are even old jobs with broken links if you click on ""apply"". Probably easier and less frustrating again to buy a newspaper and apply personally."
173,95,24,1.8,2025-11-10 21:33:19.754764,nice app helps a lot
173,40,52,2.5,2025-11-14 00:33:19.754764,Very best app for WorldWide
