user_id,app_id,usage_minutes,rating,timestamp,review
242,30,103,3.6,2025-11-17 09:33:19.754764,it so next level app for earn easy wat.
242,16,281,4.6,2025-11-18 12:33:19.754764,"Keeps logging me out mid course. While it is very useful, I find it very annoying that when I use the application on my phone, it logs me out midway of a video of a course I am watching and I have go log in again. Mind you, that's happened 3-4times in a span of half an hour. It's pretty annoying"
242,17,342,5.0,2025-11-19 15:33:19.754764,I am watching videos on mobile. If you can add zoom in and zoom out section for lectures so that we can read letters please do it.
243,71,46,2.7,2025-11-11 21:33:19.754764,"exceptional... I really loved this application the app is really helpful for competitive exams, reasoning mathematics science general awareness everything the application is providing thank you Stimy.... and keep free for all"
243,99,58,2.6,2025-11-15 00:33:19.754764,It's exceptional
243,17,159,3.1,2025-11-16 02:33:19.754764,doesn't show all the courses that I am learning. It does show up on the browser.
243,43,218,4.2,2025-11-17 04:33:19.754764,It is useless for part time workers because the managers there do not allow the part time workers to work. 50We will take money from you to make your ID.
244,61,8,1.4,2025-11-11 21:33:19.754764,"Even after buying a premium, they are again and again giving sale offers on the screen, when we are reading any article,"
244,98,91,2.7,2025-11-15 00:33:19.754764,Sure it's nice
244,26,161,3.9,2025-11-16 04:33:19.754764,I ALL READY KNOW ABOUT VEDANDU AND I LEARN IN VEDANDU YOTUBE CHANNEL. I WILL GET 500/500 IN THIS BOARD EXAM.
244,69,171,3.9,2025-11-17 06:33:19.754764,very bad shame on you
244,93,154,3.8,2025-11-18 11:33:19.754764,Little too basic
244,20,157,3.5,2025-11-21 16:33:19.754764,nice application for me and others
245,78,35,2.1,2025-11-09 21:33:19.754764,it's very useful
245,35,106,3.3,2025-11-12 02:33:19.754764,best application for job.
245,27,94,2.3,2025-11-14 05:33:19.754764,good app for all
245,24,186,3.9,2025-11-15 08:33:19.754764,this app takes a millennium to set up and takes double millennium to send otp .
245,1,162,3.9,2025-11-16 11:33:19.754764,IT IS VERY GOOD AND SPECIALLY BG REMOVER
245,21,230,4.6,2025-11-19 12:33:19.754764,not purchase the content is not sufficient
245,74,383,5.0,2025-11-21 13:33:19.754764,it's very friendly & simple to talk with. and fast response i love that
246,8,25,1.9,2025-11-08 21:33:19.754764,bed I have been deceived.
246,81,80,2.6,2025-11-12 02:33:19.754764,shiv dj palra
246,2,127,3.5,2025-11-15 07:33:19.754764,"had it fir years abd several phones. have not used it months, now it stopped working for some reason. wont recognize galaxy ultra pen or touch. useless"
246,46,242,4.8,2025-11-17 09:33:19.754764,amazing cool
246,29,213,4.2,2025-11-18 13:33:19.754764,brokerage is high
246,94,261,4.8,2025-11-19 17:33:19.754764,"can you guys add ""COLLAPSE"" to every lines, because its hard to work with messy codes"
247,24,31,2.2,2025-11-11 21:33:19.754764,outstanding app for features and study tools
247,83,77,2.7,2025-11-13 23:33:19.754764,phenomenal app. Great for learning.
247,37,102,3.4,2025-11-17 00:33:19.754764,"suppourting app, nice to catch up"
247,3,137,3.2,2025-11-18 01:33:19.754764,"very nice and helpful app, brilliant designs"
247,40,110,3.7,2025-11-21 06:33:19.754764,"Nice app, but overcrowded now."
247,21,167,3.7,2025-11-24 07:33:19.754764,"I bought a course called Yaman, I was informed by an assistant called anamika that there would be live lectures video however previous batches lectures have been uploaded. She has ill informed me. when I call the customer service. They are now telling me that it should be like that and our management is looking into it. They are just playing with their words. Worst service provider."
247,23,325,5.0,2025-11-25 10:33:19.754764,Es app ko koi bhi bhai mat download karna ye ham sab log ka account Khali kar dega mera bhai es app ne 800 rs kat 15 ar 17 December ko ar abhi tak wapas nhi kia koi log es app ko download mat karna bhai
248,70,34,2.8,2025-11-11 21:33:19.754764,Very Bad App Can't watch a full video continuously asking for money
248,16,48,2.4,2025-11-12 23:33:19.754764,I couldn't find free courses. That's why I don't like it
248,3,123,3.8,2025-11-16 02:33:19.754764,"This app is great and it helped me create some really good presentations, but now ( and especially today ) I can't log into all 3 of my canva accounts on a good Internet connection. It just says internal error 500. Edit : the issue got fixed and I got a reply on my review the same day!, thanks Canva :)."
248,6,112,3.9,2025-11-18 04:33:19.754764,thank you I want your biggest fans
248,14,206,4.4,2025-11-20 05:33:19.754764,some good reading
248,38,177,3.5,2025-11-21 10:33:19.754764,good for knowledge Job intership training
249,88,35,2.5,2025-11-11 21:33:19.754764,Beautiful ya app hai
249,39,97,2.8,2025-11-13 22:33:19.754764,best app ever
249,80,90,2.5,2025-11-17 00:33:19.754764,love this app
249,37,207,4.7,2025-11-18 01:33:19.754764,very useful
249,45,156,3.4,2025-11-19 04:33:19.754764,"This app leak your data to fraudsters and mostly HR asking money for job like, ex:Boost empowerment"
250,53,41,2.5,2025-11-11 21:33:19.754764,My experience with Medplus Bharathi Nagar Road Kovilpatti is highly satisfactory. I am getting a message as soon as my order is ready to pick up. Also I am able to place order over the phone. Response is good
250,78,60,2.6,2025-11-15 02:33:19.754764,It's like a good game it's very interesting
250,82,139,3.2,2025-11-18 07:33:19.754764,"I believe it is a useful app but after the new update I cannot access the Pro features I paid quite a bit for, and the app seemingly forgot I ever had Pro. This is quite disheartening and since I am a student I do not have the funds to purchase Pro again. EDIT: the team got back to me within the half hour and restored my purchase. Upgraded rating to 4 stars"
250,43,147,3.5,2025-11-19 09:33:19.754764,Worst App Store managers don't even agree to the fact that they require anyone for the job as if doing a favour by giving one.Also they tell you that though you are suppose to work for 4 hrs please expect to have higher time period.Their behaviour is worst.also they give you reasons to backout.This is nothing but collection of Rs 50.Because people can't join here.
250,18,221,4.8,2025-11-20 10:33:19.754764,"It has all useful course contents to consume from anywhere. They have so many free courses to learn on various topics. there are many new features (mock interview, resume builder and coding exercises etc) which could be a game changer in the coming days."
250,84,313,5.0,2025-11-22 14:33:19.754764,"I love the app , but there's a small issue... I can't download my certificate after finishing the three course. it keeps saying I haven't finished the course when I have.and when I tried to send the feedback to address the issue, it wouldn't send either.maybe I need to restart my phone, because it won't let me see your response to this."
250,32,175,3.2,2025-11-23 16:33:19.754764,very very best app
251,4,52,2.8,2025-11-11 21:33:19.754764,very very very nice this aap
251,90,56,2.2,2025-11-12 22:33:19.754764,very nice app keep it up
251,55,108,3.2,2025-11-14 03:33:19.754764,it was Awesome Experience
251,48,176,3.4,2025-11-17 08:33:19.754764,"Fraud, highly worst services, disappointed with the service. Waste of money don't recommend to buy. Before payment, the Shine team continuously followed up multiple times a day, but once payment was made (around Rs. 80,000), there was no proper support or accountability. I did not receive any real value for the amount paid. Based on my experience, I cannot recommend their services."
251,7,130,3.1,2025-11-19 09:33:19.754764,cringe pictures :(
251,14,219,4.2,2025-11-20 14:33:19.754764,the ad said absolutely free reading but that is not true
251,85,280,4.6,2025-11-22 18:33:19.754764,best app to learn c language
252,35,26,2.3,2025-11-07 21:33:19.754764,so far it's easy to use.
252,12,88,2.7,2025-11-11 02:33:19.754764,Great selection of books and podcasts. easy to take on the run. love it!!
252,67,85,2.7,2025-11-13 06:33:19.754764,great app for mental math practice
252,49,86,2.4,2025-11-14 09:33:19.754764,good health care apps
252,17,155,3.2,2025-11-15 11:33:19.754764,"I love using udemy in the browser, but the app isn't there. my biggest frustration is the videos auto play when you return to the app. Let's say you need to switch between your notes app and udemy, it will auto play every time you return to the udemy app."
252,96,249,4.5,2025-11-18 12:33:19.754764,I crashed it lol it's good btw
252,28,185,3.6,2025-11-19 14:33:19.754764,Very helpful
253,12,78,2.4,2025-11-08 21:33:19.754764,so far so good love it if it keeps going this way
253,40,92,2.7,2025-11-11 01:33:19.754764,I love the app and it easy to use
253,2,154,3.5,2025-11-13 05:33:19.754764,these app it will be worked so so so nice nice this app used for artists and so many people this app can I can give review 100 by 1000 this app useful for people so so so so so so so so so so so so so so so so so so so so nice nice nice nice this app nice who created this app they are first prizefrom me pizza so so so so so so so nice nice nice nice nice nice nice this app US best experience in this app so people see this app nice nice nice nice nice nice nice I am advanced Singh for this nice
253,46,197,3.6,2025-11-14 10:33:19.754764,the great app .the simple off apply job
254,60,39,2.6,2025-11-11 21:33:19.754764,very nice very good
254,11,108,3.6,2025-11-14 23:33:19.754764,"Great way to skill up, relax and spend time with care. You grow from reading in wonderful ways."
254,81,116,3.3,2025-11-17 03:33:19.754764,sir aap bahut achha padate hai
254,12,184,3.3,2025-11-19 04:33:19.754764,love audible so much the recent additions of full cast editions is such a game changer. just wish it was a little bit more affordable.
254,92,253,4.9,2025-11-22 05:33:19.754764,this app is the bestest for mobile users
255,12,20,1.3,2025-11-10 21:33:19.754764,I love this app so much
255,64,57,2.7,2025-11-12 22:33:19.754764,"greedy people, you don't give the opportunity to read the paper for free for students"
255,13,164,3.8,2025-11-15 01:33:19.754764,even when you click English they don't show you English options unless you search for it plus they don't even have most of the books in interest in.
255,59,108,3.8,2025-11-16 06:33:19.754764,speedy news around
255,41,169,3.4,2025-11-18 11:33:19.754764,Make it more feasible to use
255,22,169,3.4,2025-11-21 14:33:19.754764,Excellent explaining and animation
256,8,23,1.5,2025-11-11 21:33:19.754764,"horrible app, tried logging into it and it kept kicking me out, i dont recommend!"
256,95,65,2.5,2025-11-13 01:33:19.754764,this app is very good you can learn easily
256,32,90,2.2,2025-11-15 02:33:19.754764,very good experience
256,90,150,3.4,2025-11-17 04:33:19.754764,Literally amazing app
256,72,169,3.1,2025-11-18 08:33:19.754764,too many ads very disappointed pls don't download
256,2,215,4.6,2025-11-20 10:33:19.754764,it's good but lags way too much .
256,20,347,5.0,2025-11-21 13:33:19.754764,thank you for your help
256,14,338,5.0,2025-11-22 15:33:19.754764,it's a great apl for me to find great reads that I can't put down!
257,9,46,2.4,2025-11-07 21:33:19.754764,is cool. but problem is layer video 1 is non speed layer video 2 is fast. please fix
257,36,36,2.8,2025-11-11 00:33:19.754764,its very helpful to my future thank you work India
257,52,85,2.9,2025-11-13 03:33:19.754764,overall app is good but some medicines are not available so I'm giving it 4*
257,11,164,3.7,2025-11-15 08:33:19.754764,"great app, sometimes doesn't sync between my Kindle and this app on my phone"
258,72,49,2.6,2025-11-06 21:33:19.754764,love this. A good way to practice mental calculations
258,77,73,2.8,2025-11-07 23:33:19.754764,I can not recreate a new acc can u help me plss I already messaged ur email!? I used this app before I did like it it's been kinda like a yr I was using and I think if u really use this app for learning it will definitely help really helps and wanted to recreate new acc so the rooms the AI sounds good the features of the app and the celebration of the birthday it's fantastic. it looks like ur kinda meeting ppl around the world from your home and it's amazing brilliant wanna give an answer pls
258,26,145,3.1,2025-11-11 03:33:19.754764,very useful for practising and Best learning app ever !
258,10,214,4.1,2025-11-12 07:33:19.754764,very nice story I like it is
258,93,284,4.2,2025-11-13 11:33:19.754764,Brilliant and incredibly useful for editing while on the go.
258,86,194,3.6,2025-11-14 14:33:19.754764,Coding X is a very nice app for learning coding
258,75,263,4.3,2025-11-16 17:33:19.754764,"""unfortunately you can't sign up, that email is in use"" you mean, ""it looks like you already have an account, please sign in""?"
259,53,21,1.4,2025-11-09 21:33:19.754764,very good app easy to use
259,46,77,2.4,2025-11-13 02:33:19.754764,"This is a good app but the job vacancies listed here are not of the type we want to apply for, from driver to sweeper etc., but the vacancies listed here are very less. Different vacancies appear."
259,70,138,3.6,2025-11-16 06:33:19.754764,it is very good
259,55,101,3.1,2025-11-17 07:33:19.754764,Good message Delivered Daily Updates Thank you way2News
259,67,312,5.0,2025-11-18 11:33:19.754764,"amazing app, just a suggestion that please add the feature that enables us to type the number from back in competitive duels as well. and the mode can be switched on the go."
259,98,342,5.0,2025-11-21 15:33:19.754764,"the app is very useful, but I have one major technical issue.there is an input bar that keeps blocking me from seeing what am coding please remove this setting so that I can use the phone's electronic keyboard for input. but everything else works just fine"
259,43,231,4.7,2025-11-24 18:33:19.754764,Thandam 50rs and My valuable time. Scam blinkit
260,16,45,2.9,2025-11-09 21:33:19.754764,Overhyped. Cybersecurity courses offered through coursera are useless for getting a job unless you already have a computer science degree
260,45,62,2.8,2025-11-13 00:33:19.754764,Immediate response against frauds or fake jobs
260,60,93,2.1,2025-11-16 02:33:19.754764,new update full bug can't open video hang entire app too much ads pop-up
260,53,231,4.4,2025-11-18 07:33:19.754764,the customer service is the worst I have ever experienced
260,83,172,3.6,2025-11-19 12:33:19.754764,here's no code editor to practice it by yourself
261,50,46,2.3,2025-11-11 21:33:19.754764,Do not working this app
261,94,85,2.7,2025-11-13 02:33:19.754764,this helped me so much when I was not having a laptop.... thank you
261,23,88,2.2,2025-11-16 04:33:19.754764,good but dark test doesn't show in dark mode.
261,52,91,2.7,2025-11-17 09:33:19.754764,"i paid for express delivery and they said it was out for delivery but then they said it is postponed as delivery was attempted but failed, i didn't get any calls or messages. on the app it was showing that it will come the next day, but when i called customer care i talked to a bot who kept saying it will come the same day, and it still hasn't come. worst customer care service and delivery"
261,41,127,3.6,2025-11-20 13:33:19.754764,highly recommend easy to use and flexible platform and amazing they promote new freelancer.
262,29,70,2.3,2025-11-11 21:33:19.754764,arw bhai mere ko nhi karni hai trading har jagah add dhikake pareshan kar rahe ho
262,39,69,2.6,2025-11-13 22:33:19.754764,This app is very good for finding jobs
262,25,148,3.2,2025-11-14 23:33:19.754764,Amar jonnye unacademy best option chilo kintu kano j bangla department ta closed kore dilo abar jodi chalu hoy khub valo hoy.
262,69,92,2.8,2025-11-17 01:33:19.754764,very nice app
262,32,128,3.2,2025-11-19 02:33:19.754764,very good app
263,41,31,2.6,2025-11-09 21:33:19.754764,best app for freelancing
263,82,91,2.6,2025-11-11 00:33:19.754764,it is very good
263,58,148,3.2,2025-11-12 05:33:19.754764,Why non relevent videos are added in every news. You have some logic to show it but it defeats purpose in my view. Those videos appear grossly not relevant to news one is reading and waste of time if opened by mistake.
263,21,213,4.2,2025-11-15 06:33:19.754764,aap k app par koi bhi free test series nahin Hai
263,24,165,3.3,2025-11-16 08:33:19.754764,please don't buy uts course it's fraud
263,39,220,4.2,2025-11-18 11:33:19.754764,very nice application
263,2,348,5.0,2025-11-21 14:33:19.754764,very responsive drawing app
264,26,46,2.2,2025-11-07 21:33:19.754764,It was very helpful and was free of cost when shimon sir introduced the ved features i thought it would cost but it didn't it helped me with my studies and i aced my exam MUST TRY !!!!!
264,88,88,2.6,2025-11-11 01:33:19.754764,"This app is good and it's ai is also powerful, but it's should be more open source, it only let you build one and than the ai show to many bugs and lagging and app doesn't function properly, plus when I take subscription of it still has limits. Make it more open source and add some subscription relax."
264,92,134,3.4,2025-11-13 06:33:19.754764,"I really recommend this app for someone whos want to get code python in phone. It has all the features you need, syntax highlight, plenty of library. Although it has ads, it won't bothering you. To the developer, can you add that you can use custom fonts in the editor."
264,36,146,3.1,2025-11-15 07:33:19.754764,very good app
264,51,197,3.8,2025-11-17 12:33:19.754764,"Dr. Sanjay Sinha, urologist from apollo hyderguda is the best urologist one can consult without any hesitation. His patience, knowledge, experience, professional advice, communication skills, on time consultation are all commendable. Infact, in every respect, he is a perfect choice for those who want online/ offline urology consultations. May God bless Dr. Sinha with the very best always."
264,14,133,3.2,2025-11-20 15:33:19.754764,"when I started to use tapon for read story,there was 8 chapters free for daily read are now decrease only 2 chapters,50 coins for to see 5 add which are decrease to 30 coins,for read 120 minutes a day,they gave 60 coins are now decrease 35 coins,though they add some coins to read 3 articles,but that's not sufficient for readers like us.. lots off books there they never updated any chapters,I do mail tapon several times but they even don't give any reply.. day by day tapon is being commercial..."
265,10,17,1.6,2025-11-07 21:33:19.754764,everyday minimum 5 parts open plz
265,28,110,3.4,2025-11-09 23:33:19.754764,good app to learn code with..
265,85,119,3.3,2025-11-13 00:33:19.754764,"This app is really good for the freshers like me. I suggest this app for students who are Inspired programing language like C. And I suggest to developer , the compiler is slow and sometimes it is not work please resolve These problem for better improvement in our study of C language . So thats why I am given 4 star otherwise I definitely give 5 star. And please resolve the problem !"
265,48,221,4.8,2025-11-14 05:33:19.754764,fake job postings only get calls from a shine agents for money. All this is a scam don't fall for such job opportunities you can get a job without any payment to a agent .if they can give you job why they don't buy there services themselves and get a good job rather than spamming call
265,19,241,4.8,2025-11-17 09:33:19.754764,It actually stops an individual with so many policies.
265,41,287,4.9,2025-11-18 10:33:19.754764,really expensive services in my professional role...
266,77,38,2.7,2025-11-07 21:33:19.754764,this app is amazing
266,42,54,2.8,2025-11-10 00:33:19.754764,"I find it more efficient and has fascinating features, too. Keep it up!"
266,76,85,2.5,2025-11-11 03:33:19.754764,They make learning Spanish easy and fun.
266,50,161,3.4,2025-11-14 06:33:19.754764,work hi nhi karta balki bina app ke hi iska kam acche se ho jata hai
266,31,268,4.4,2025-11-17 09:33:19.754764,I hate these updated systems every time they are updated they are very confusing. Every time I exit positions they change and confuse the trader. The previous strling sl in the exit system was great
266,74,202,4.4,2025-11-19 13:33:19.754764,very usefull thankyou
266,3,178,3.1,2025-11-20 14:33:19.754764,A perfect app i love editing using this app no lag perfect for beginners go ahead guys
267,12,8,1.8,2025-11-07 21:33:19.754764,love the story's. wide variety to choose from.
267,25,51,2.4,2025-11-08 22:33:19.754764,I will only say don't use this app if you want to be a failure in your life.
267,93,136,3.2,2025-11-11 00:33:19.754764,"I am currently using this app because this app is going to solve, I learn coding language with this app"
267,48,220,4.6,2025-11-12 05:33:19.754764,"biggest fraud in the market, forcing customers to buy other packages and then again other packages, saying those previous packages will not work until you buy the new one, then after that activating them in our account without user consent"
267,69,257,4.5,2025-11-15 07:33:19.754764,"saral or sugam tarike se doubt clear karte hue ,concept bhi clear karte hue regardless of time taken and repeating the doubts and concept misunderstanding no matter."
268,34,48,2.8,2025-11-06 21:33:19.754764,"love thr app, makes it so easy to do my work."
268,99,56,2.3,2025-11-09 22:33:19.754764,free atleast pratice session
268,38,117,3.4,2025-11-12 02:33:19.754764,it is your useful for students who can gain knowledge and develop their skills
268,92,212,4.2,2025-11-14 05:33:19.754764,I like it's free to use
268,11,213,4.8,2025-11-15 07:33:19.754764,who doesn't love a good book? you can travel back in time or ride on the back of a motorcycle to finding the killer. kindle has it all
269,36,40,2.5,2025-11-06 21:33:19.754764,great app..
269,55,64,2.5,2025-11-09 22:33:19.754764,it's very useful to us
269,22,162,3.4,2025-11-11 02:33:19.754764,noice man bald man teach smooth like butter
269,88,169,3.2,2025-11-14 03:33:19.754764,"not very free, I can't chat very well, it has limit, very money hungry, also I need to develop a website, but it doesn't let us post it. As for the Birdieficialist Team, needs to hire a coders, but too expensive..."
269,40,127,3.3,2025-11-16 08:33:19.754764,"Great resource to connect with freelancers around the world. But the platform is greedy, they charge both customers and the freelancer for each gig. The double dipping from both ends. They even charge you extra for tipping the freelancer."
270,38,54,2.4,2025-11-07 21:33:19.754764,Very helpful app for students. Easy to use and informative.
270,25,44,2.1,2025-11-10 23:33:19.754764,sir video lecture me face invisible h jaldi se update kar dijiyega face dikhai de
270,52,80,2.2,2025-11-14 02:33:19.754764,superb aap for medicine
270,23,163,3.3,2025-11-17 06:33:19.754764,best solution and discussions
270,77,168,3.7,2025-11-20 09:33:19.754764,this app is more dating than learning now like the influx of ppl posting body pics in their posts is ridiculous and frankly pathetic than how this app was years ago
270,36,344,5.0,2025-11-23 12:33:19.754764,a bahut achcha hai per
270,68,352,5.0,2025-11-24 13:33:19.754764,It an amazing app and I know you will enjoy it too
271,41,25,1.9,2025-11-07 21:33:19.754764,overall its great opportunity for someone who wants to earn online. But I would suggest add the field of optometry as well.
271,88,47,2.9,2025-11-10 01:33:19.754764,"When the owners charge you every two days for a failed build that you could not control , I say , that's just a money grab."
271,9,102,3.4,2025-11-11 03:33:19.754764,now finally I can animate for YouTube
271,22,151,3.2,2025-11-14 04:33:19.754764,very bad app
271,24,242,4.2,2025-11-17 07:33:19.754764,this is a best learning app
272,43,24,1.3,2025-11-11 21:33:19.754764,After Reading All Reviews i visit personly to Mazgaon Store. The Staff Said No vacancy at Stores.Why This App want Adhar and pan??? while there is no Vacancy???
272,58,114,3.5,2025-11-14 00:33:19.754764,"pathetic qa of the app. you can only copy the 1st few lines of the article. the new comment system is worst. its spell check does not work and misinterprets the scroll down gesture in the comment box and discards the comments. consequence of hiring cheap devs and testers because most of your expenses are paying the good for nothing managers. you cant hire skilled people because your policy says you cant pay tech people more than managers, as a result the good people leave."
272,63,172,3.6,2025-11-15 03:33:19.754764,HT is always there when u need latest and widest coverage of news
272,95,140,3.5,2025-11-17 05:33:19.754764,easy way to learn coding
272,45,178,3.2,2025-11-20 09:33:19.754764,after applying this job I received fake job calls please verify job postings most of are fake
272,70,338,5.0,2025-11-23 10:33:19.754764,answer of a question is wrong in gk quiz of mes school pattambi it says the most populated country in the world is china even though it is India even tgough my school payed the subscription for a year
273,87,35,2.3,2025-11-08 21:33:19.754764,this app is very useful for me and no ads contain
273,45,79,2.7,2025-11-12 00:33:19.754764,this company's asked for money and this fraud and fake company here
273,43,62,2.8,2025-11-14 03:33:19.754764,easy to use
273,51,166,3.5,2025-11-16 05:33:19.754764,Pathetic service. they don't deliver medicines on time. Not dependable
273,76,139,3.3,2025-11-18 09:33:19.754764,"it's really good for fluent speaking and helps you fix your mistakes, and if you want, you can practice your conversations between one person with this app, the only thing is that they made almost everything premium."
