user_id,app_id,usage_minutes,rating,timestamp,review
71,21,68,2.3,2025-11-14 23:33:19.754764,manu lagda aw app te mnu govt job dva k hi shdu...... thank you so much manoj sir and fathe sir
71,36,97,2.3,2025-11-17 00:33:19.754764,Real Jobs - 10% Fake jobs - 90%
71,12,194,3.5,2025-11-18 05:33:19.754764,Audible keeps me entertained for hours and hours
71,84,217,4.2,2025-11-21 08:33:19.754764,best app to learn programming
72,14,32,2.8,2025-11-11 21:33:19.754764,"an FYI your subscription wont show up in google. you have to go to the app, the cluck on shorts at bottom. After that go to upper right corner and click history...thats should be where your subscription is located..thats why only 3 stars. The stories are ehhhh some good, some bad."
72,41,75,2.1,2025-11-14 23:33:19.754764,"Transparent, simple and secure."
72,48,108,3.7,2025-11-16 03:33:19.754764,"Worst experience in my life. They are cheaters. They sell their products in the name of Hindustan Times. Their, sales person will show a big dream with 94-95% success. They will sell their services one by one, and after selling one service, they will say, the services you bought, will work well, if you take this new service. This way I lost a total of 76000 (my hard earned money). After taking money they will disappear, say it's non refundable, only way is to pay for extra service. horrible."
72,39,116,3.2,2025-11-19 07:33:19.754764,"local jobs app, very use full to the youth and very easy to use and these provide the jobs near in our state and other states and easy process to apply to the jobs and these app providing the details very clear and an option they provided is that we can call directly to HR and we can talk, super app.."
73,55,34,2.6,2025-11-08 21:33:19.754764,very nice good
73,41,87,2.5,2025-11-11 22:33:19.754764,Till now I did not get any work
73,18,89,2.8,2025-11-13 02:33:19.754764,why so few options in education my friend has done ITI and now is studying for BA he was thinking to do any course
73,32,127,3.6,2025-11-15 06:33:19.754764,nice app for money save
73,36,187,3.4,2025-11-18 07:33:19.754764,this app is very excellent and truly worth it.
73,83,314,5.0,2025-11-21 11:33:19.754764,so far so good
73,11,345,5.0,2025-11-23 12:33:19.754764,"I have been using this app more regularly only recently. It has become an indispensable part of my reading habit. I would however like this app to extend in so many different ways 1. export highlights and notes, 2. Improve highlight color options and themes, 3. improve collection for foreign language books in Germany."
74,51,69,2.4,2025-11-06 21:33:19.754764,improved in delivery time
74,65,111,3.6,2025-11-08 22:33:19.754764,copy cat no true journalism
74,37,138,3.3,2025-11-10 01:33:19.754764,good app jenue work
74,81,216,4.7,2025-11-13 04:33:19.754764,the muke is not working
75,56,41,2.6,2025-11-11 21:33:19.754764,Best news app
75,94,49,2.2,2025-11-13 23:33:19.754764,what an app
75,31,144,3.7,2025-11-15 03:33:19.754764,It Is a Intresting and earing app
75,8,130,3.7,2025-11-17 05:33:19.754764,this is an interesting app
75,32,143,3.7,2025-11-20 06:33:19.754764,good working
75,12,316,5.0,2025-11-23 07:33:19.754764,Awesome! Love listening to books & podcast on Audible.
76,8,27,2.7,2025-11-08 21:33:19.754764,creat image
76,64,49,2.8,2025-11-12 02:33:19.754764,"Very slow loading of e-paper pages, quite frustrating"
76,73,140,3.2,2025-11-13 06:33:19.754764,I love this app! it really helps and it's very encouraging. I definitely recommend for anyone wanting to learn a new language. it also has different courses other than languages like chess and math.
76,22,141,3.4,2025-11-16 10:33:19.754764,Goo Goodbyes
76,48,211,4.5,2025-11-18 11:33:19.754764,when I tried to update my profile and profile summary then the app crashed and only the blue screen was coming
76,21,173,3.4,2025-11-19 13:33:19.754764,free bolke payment manate haii
76,33,187,3.5,2025-11-21 16:33:19.754764,the best regards to u mt5
76,99,332,5.0,2025-11-22 19:33:19.754764,lovely app. Great for learning different programming languages
77,99,33,2.5,2025-11-09 21:33:19.754764,it has fallen off. the lessons are terrible too. it's not worth it
77,26,119,3.7,2025-11-11 22:33:19.754764,I LOVE this APP after using 1 year the teachers are very friendly and give us very good amount of education . thank you vedantu team .
77,94,116,3.5,2025-11-13 00:33:19.754764,let me give you 5 stars without polishing for sure i have attained a proficient skill in coding C++ just with the help of a PDF and Cxxdroid where I practiced my as if I had the PC on my Phone imagine. Just a wonderful application
77,70,100,2.3,2025-11-14 03:33:19.754764,not bad but ok
77,98,230,4.9,2025-11-17 07:33:19.754764,signed up to learn instead im begged for money goodbye. i have principles
77,32,192,3.8,2025-11-20 08:33:19.754764,nice app for money save
77,20,306,5.0,2025-11-23 13:33:19.754764,wow very nice teaching parform thank you so much
77,1,325,5.0,2025-11-24 16:33:19.754764,"It's a really a good app. If you use it smartly, you can use it in various way."
78,35,41,2.2,2025-11-09 21:33:19.754764,job nhi milta
78,30,70,2.4,2025-11-12 00:33:19.754764,im so happy i dont know what say
78,10,128,3.2,2025-11-14 03:33:19.754764,super story
78,26,220,4.3,2025-11-17 06:33:19.754764,"vedantu cooked this app, it is the best app for students. pls try this app it is a gem for students."
78,18,175,3.4,2025-11-19 08:33:19.754764,app crashing unexpectedly
78,99,171,3.9,2025-11-20 11:33:19.754764,Exceptional
79,60,7,1.2,2025-11-06 21:33:19.754764,use full app
79,14,102,3.8,2025-11-08 22:33:19.754764,Worst app and customer service extremely poor.
79,18,133,3.2,2025-11-09 23:33:19.754764,the best so far
79,16,103,3.8,2025-11-11 00:33:19.754764,"Keeps logging me out mid course. While it is very useful, I find it very annoying that when I use the application on my phone, it logs me out midway of a video of a course I am watching and I have go log in again. Mind you, that's happened 3-4times in a span of half an hour. It's pretty annoying"
79,2,127,3.6,2025-11-14 04:33:19.754764,I love this app sooo much once you get to known the brushes you can create literally anything I've been using it for like 4 years and it's the only app that I can ever use!
80,36,46,2.6,2025-11-08 21:33:19.754764,Not getting any real jobs every job I get is like an agency asking for money saying security deposit refundable amount etc all fake jobs no real jobs
80,58,55,2.3,2025-11-11 02:33:19.754764,best app newa
80,20,154,3.6,2025-11-13 04:33:19.754764,Nice app for learning new skills. Good experience.
80,5,191,3.5,2025-11-14 08:33:19.754764,"The models look very much like AI, hands are too smooth it doesn't look real. Products look like they have the background removed and then simply put on the model, no shadows, looks like a simple overlay that can be done with anything in 3seconds. Not at all realistic jewelry images. Was forced to pay a plan to try it. Regret it."
80,79,204,4.3,2025-11-16 13:33:19.754764,very good jop
81,36,56,2.9,2025-11-06 21:33:19.754764,one of the best applications for job seekers
81,8,97,2.7,2025-11-07 23:33:19.754764,I just opened the app works fast and securely but I can't give it 5 stars because I haven't explored the app yet
81,61,137,3.8,2025-11-09 04:33:19.754764,"Have been premium user since last many years, quality has been deteriorating over time, incase you happen to subscribe avoid renewal offer they continuously push on the app as well as on whatsapp as on renewal they will not renew from expiry date but date of payment, moreover inspite of premium subscription they show ads! why pay for viewing ads."
81,68,182,3.7,2025-11-10 06:33:19.754764,this is the best app for improve your mathematics
81,46,243,4.6,2025-11-13 07:33:19.754764,"Naukrigulf is a useful app for job seekers in the Gulf region. It allows users to search and apply for jobs easily, and the interface is simple to understand. Notifications for new job postings are helpful, and profile setup is quick."
82,40,38,2.5,2025-11-10 21:33:19.754764,"poor app riddled with bugs on android. login tells me to reset password, password reset email takes me to app, with nowhere to reset password. have to delete app to reset password and now it tells me password not valid. also, clicking back once logged in takes you to login and logs you out, and then I can't log back in, due to above. go to mobile website and told to use app as it's 'better' (it's absolutely not). have given up on the project and posted on Upwork instead."
82,23,50,2.7,2025-11-13 02:33:19.754764,"not useful, seems only for decieting and fund raiser app."
82,63,77,2.7,2025-11-15 03:33:19.754764,HT is always there when u need latest and widest coverage of news
82,5,106,3.7,2025-11-16 08:33:19.754764,"App was professional and gave good quality images before I made the purchase, but as soon as I purchased the app. The quality of the images produced dropped immediately."
82,12,179,3.4,2025-11-18 13:33:19.754764,I love having Audible books loaded on my phone for driving trips.
82,8,380,5.0,2025-11-21 17:33:19.754764,after subscribe monthly app not working it's fraud.
82,30,363,5.0,2025-11-24 20:33:19.754764,"try now, best apk"
83,40,41,2.7,2025-11-09 21:33:19.754764,The best experience. Thank you Fiverr team.
83,94,79,2.8,2025-11-12 22:33:19.754764,Good. Easy to run codes.
83,89,112,3.4,2025-11-16 03:33:19.754764,amazing teaching techniques you should must be try it if you make your career in coding..!
83,38,130,3.8,2025-11-17 06:33:19.754764,this is one of the best platforms to grab the opportunities to the professionals and students to find the right job right in the internship.
83,17,116,3.3,2025-11-20 09:33:19.754764,"excellent option! please go ahead and continue, even with coursera acquisition"
84,1,51,2.8,2025-11-11 21:33:19.754764,"So far, so good. I'll try it a few more days before committing to a subscription."
84,7,81,2.8,2025-11-14 00:33:19.754764,it is supper app and the ads are tirrible
84,50,108,3.7,2025-11-17 02:33:19.754764,wow super app
84,57,158,3.2,2025-11-19 03:33:19.754764,never seen any news
85,10,61,2.1,2025-11-11 21:33:19.754764,interesting
85,71,58,2.2,2025-11-13 02:33:19.754764,"its better than chat gpt ,I love this app so much I scored 50/50 in maths last time becoz of this app"
85,12,177,3.8,2025-11-14 06:33:19.754764,relaxing and entertaining
85,44,127,3.1,2025-11-16 09:33:19.754764,good experience
85,77,175,3.4,2025-11-18 11:33:19.754764,why I can't download this app? why it's not allowed to install it on this device ? I need a solution for that please
86,13,39,2.7,2025-11-07 21:33:19.754764,It is very good that you can listen and read books. The subscription is very good.
86,4,71,2.2,2025-11-10 00:33:19.754764,pleasurable
86,27,108,3.3,2025-11-12 03:33:19.754764,EXTREMELY VERY HIGHLY EXCELLENT BEST REMARKABLE MARVELLOUS VERY MUCH USEFUL FOR STUDIES
86,22,186,3.2,2025-11-14 05:33:19.754764,noice man bald man teach smooth like butter
86,82,242,4.6,2025-11-15 08:33:19.754764,It's a scam trying to syphon your card details & also used some sandbox PayPal site trying to syphon PayPal login details. Avoid like the plague that it is. DataCamp is safer and better.
86,38,293,4.5,2025-11-16 12:33:19.754764,it's actually useful App for a newbie.. Go for it
86,11,266,4.4,2025-11-19 14:33:19.754764,"Very nice aap, Good for all"
87,87,17,1.0,2025-11-10 21:33:19.754764,Excellent app.
87,80,76,2.8,2025-11-14 01:33:19.754764,best app for learning Thai
87,19,110,3.4,2025-11-16 02:33:19.754764,"this app is great blend of opportunities and education ,very great app ,good for all , go get this app"
87,16,114,3.7,2025-11-18 07:33:19.754764,I can't download certificate easily it's hard to do it
87,97,195,3.2,2025-11-21 11:33:19.754764,Best app for all type of language and programming
87,58,204,4.3,2025-11-22 16:33:19.754764,Since the latest update the notifications are bombarded despite only Breaking News being selected in the notifications menu.
87,23,300,4.5,2025-11-24 20:33:19.754764,khud k app pe testbook ka khud ka ad jisme koi kutta ki tarah bhauk raha pls usko band kro bhai
87,22,282,4.2,2025-11-26 21:33:19.754764,"Iam, having. Full. Experience. I'm,Using. Mobile. Last.15 to 25years. Continously. Sidda.Prahalad."
88,31,27,2.7,2025-11-11 21:33:19.754764,101% extra brokerage & charges
88,7,97,2.3,2025-11-14 01:33:19.754764,too many ads but it's too good for the trouble
88,96,137,3.7,2025-11-17 05:33:19.754764,i don't know cong but i do it it app is very helpfull 'thank you'
88,61,162,3.8,2025-11-20 06:33:19.754764,Don't go with this app for any loan. Initially they will you have this much loan and ask all the kyc and emi mandate registration. They will reject your loan request once the all the process completed. They can tell this before submitting details. Atleast before emi mandate registration. They are completely fraud. They want customer s data. That's why they doing like this
88,35,287,4.4,2025-11-23 10:33:19.754764,"I'll give 4 stars due to the sheer usefulness of the app, however, the fake/misleading jobs are what stops that final star from being added. Be careful who you give your info to, people! If it seems too good to be true, there is a possibility that it is, so be aware!"
88,48,221,4.5,2025-11-26 12:33:19.754764,very good and helpful site
89,25,5,1.8,2025-11-07 21:33:19.754764,this app is very spam and or ye dhoka khdi wala hai to ye app logo ke sath spam krta hai chngul me f sata hai
89,26,93,2.6,2025-11-10 00:33:19.754764,"very useful ,time save , easy to understand"
89,8,116,3.6,2025-11-13 01:33:19.754764,app didn't even work
89,32,172,3.2,2025-11-15 06:33:19.754764,good working
90,50,62,2.3,2025-11-06 21:33:19.754764,ayushman aap good work application for bill stetment sow h
90,7,36,2.8,2025-11-09 02:33:19.754764,cringe pictures :(
90,21,76,2.6,2025-11-10 07:33:19.754764,there is nothing for free
90,74,186,3.4,2025-11-13 10:33:19.754764,not interested thank you
90,28,257,4.6,2025-11-14 14:33:19.754764,edX is a great platform I have been using it since 2019 to sharpen my software development skill.
90,29,264,4.6,2025-11-15 15:33:19.754764,this application is not for Fno kindly don't do Fno while doing Fno not working properly
91,9,28,2.6,2025-11-09 21:33:19.754764,l can make pbs kids.
91,44,96,2.1,2025-11-10 23:33:19.754764,good experience
91,36,122,3.1,2025-11-14 02:33:19.754764,Not getting any real jobs every job I get is like an agency asking for money saying security deposit refundable amount etc all fake jobs no real jobs
91,82,173,3.7,2025-11-16 05:33:19.754764,automatically return to the home page.can't use after purchase
92,93,69,2.9,2025-11-08 21:33:19.754764,it's better
92,92,70,2.3,2025-11-12 00:33:19.754764,"best python ide ever! like it is offline,you can download packages and all and it's free"
92,29,180,3.8,2025-11-13 03:33:19.754764,trying to enter pan number but it takes only 9 digits. i don't think it is keyboard problem. if i can't enter pan details i can't use the app.
92,88,147,3.7,2025-11-15 04:33:19.754764,very good app and helpful
92,69,185,3.3,2025-11-17 07:33:19.754764,100 percent achha hai bahut friendly hai
93,80,46,2.1,2025-11-10 21:33:19.754764,it's such a great app.
93,10,85,2.8,2025-11-11 23:33:19.754764,super agide story
93,61,131,3.2,2025-11-13 02:33:19.754764,app not opening on Android os
93,25,201,4.1,2025-11-16 04:33:19.754764,unable to watch recorded class for neet UG
93,65,171,3.7,2025-11-17 06:33:19.754764,Good app for unbiased news report. Everyday morning I spend about 10 minutes for the complete news headlines and which interest me.
93,16,340,5.0,2025-11-18 11:33:19.754764,"Worst Application I have Even Used. I had purchased a course It was described about the refund policy for one month. But At the Same Day of Subscription I Send A refund request, The email came and it was described The refund should appear on your account in 5-7 days if issued to a credit card. But When I was purchasing They Didn't describe refund is only accepted if purchased through Credit card."
93,88,145,3.5,2025-11-20 15:33:19.754764,"Utterly amazing. I feel like I have a team of expensive full-stack developers that work for peanuts and code impossibly fast, doing days of work in mere minutes. I've used other platforms and Replit is BY FAR THE BEST!!! The vibe-coding revolution has been life changing for me. I feel bad for devs entering the workforce."
93,49,397,5.0,2025-11-22 16:33:19.754764,good app nice working
94,89,42,2.3,2025-11-07 21:33:19.754764,"too fragmented & too slow in progress, too much water"
94,45,90,2.5,2025-11-09 00:33:19.754764,very nice app
94,40,109,3.9,2025-11-11 04:33:19.754764,Nice experience
94,17,145,3.3,2025-11-13 06:33:19.754764,"The app has as been great until recently when I won't be able to play downloaded videos, asking me to use a computer."
94,14,250,4.2,2025-11-14 07:33:19.754764,too expensive
95,80,23,1.1,2025-11-10 21:33:19.754764,"The app asks questions about the language that it never explained or translated... it's like they didn't really care designing courses or haven't tested them with real users. Also, the app is not designed for multiple languages. You can choose another language through settings but they don't test you for a second language to assess your level. I am definitely not paying for the app."
95,7,86,2.7,2025-11-12 22:33:19.754764,It helps me a lot of art
95,77,132,3.2,2025-11-15 23:33:19.754764,good Enough
95,85,135,3.8,2025-11-18 04:33:19.754764,This app is beautiful
95,14,162,3.7,2025-11-21 09:33:19.754764,Awful. This is the worst reading app I have tried. Extremely short chapters and very long commercials. Do yourself a favor and look elsewhere. I'm deleting this app today.
95,84,218,4.5,2025-11-22 14:33:19.754764,simple! good for starting
96,6,21,1.0,2025-11-07 21:33:19.754764,i love this Drawing game
96,71,97,2.9,2025-11-09 02:33:19.754764,it's very helpful and nice
96,64,126,3.3,2025-11-12 03:33:19.754764,The Beginning of morning with ET.
96,27,164,3.2,2025-11-14 06:33:19.754764,"Government app always remain slow and full of bugs . Guys if you don't know how to make app quit the job and give us money we ll do it . And the things setup in app is also so difficult to understand and surf ...ufff , And what course is like apply now and get enroll after month and year , what the hell for waiting time . How other private paid app can do it instantly and even if they have time they make their process easy and keep on calling .What about you ..I don't found any useful ."
96,89,196,3.7,2025-11-15 09:33:19.754764,Perfect step by step procedures are used to help master everything.
96,62,168,3.4,2025-11-16 10:33:19.754764,I hv only this News 18 app beside Anandabajar Potrika.I get enough news to update myself.Thank you.
97,44,33,2.8,2025-11-08 21:33:19.754764,Good souret
97,24,57,2.7,2025-11-10 23:33:19.754764,Its a very app concept are now clear
97,15,162,3.6,2025-11-12 03:33:19.754764,Good but could be great. I wish we could connect to the Audible app and that you could find audio versions easier
97,52,169,3.1,2025-11-13 08:33:19.754764,"High quality products with quick and easy delivery at remotest part of our country - Andaman nicobar islands. Thanks Pharm Easy for being for and with me , in distress."
98,57,41,2.7,2025-11-09 21:33:19.754764,"Covers a wide range of newsworthy topics in America and around the world, including sports"
98,6,108,3.7,2025-11-13 00:33:19.754764,it is a grat game l love it
98,9,135,3.6,2025-11-15 02:33:19.754764,it is really good
98,34,108,3.6,2025-11-16 07:33:19.754764,scammer hub
99,10,10,1.5,2025-11-07 21:33:19.754764,very good reading app
99,97,68,2.7,2025-11-09 23:33:19.754764,It can run whole code platforms on your mobile
99,63,111,3.9,2025-11-11 03:33:19.754764,sirf paisa lekar news niklata hai
99,42,164,3.5,2025-11-12 04:33:19.754764,a good app for job search in the market
99,31,288,4.8,2025-11-13 09:33:19.754764,this is the Best app
99,43,262,4.1,2025-11-14 13:33:19.754764,good for part time jobs
99,36,408,5.0,2025-11-16 16:33:19.754764,Best job app
100,13,57,2.5,2025-11-06 21:33:19.754764,horrible UX and sometimes info is completely wrong. series numbered wrong. extremely lazy
100,98,65,2.8,2025-11-07 22:33:19.754764,its very understandable and helpfull
100,85,109,3.2,2025-11-09 01:33:19.754764,Great application for beginners
100,29,147,3.4,2025-11-11 03:33:19.754764,never got a single IPO
100,1,271,4.7,2025-11-13 04:33:19.754764,it's very good
100,44,202,4.5,2025-11-15 09:33:19.754764,this platform is very good and real job on nokri com so this helpful for which is find job
100,46,343,5.0,2025-11-18 10:33:19.754764,good app for searching good jobs
101,75,43,2.8,2025-11-11 21:33:19.754764,this app is great and useful
101,23,81,2.4,2025-11-14 01:33:19.754764,iss app ka supercoaching bahat kharab hai
101,94,77,2.6,2025-11-16 05:33:19.754764,"Almost perfect, just needs PortAudio support because PortAudio is really mainstream!"
101,17,205,4.3,2025-11-18 10:33:19.754764,Educative app
101,14,240,4.6,2025-11-21 13:33:19.754764,too expensive
102,82,67,2.6,2025-11-11 21:33:19.754764,"An excellent app for learners, providing quick fixes and enhancing productivity."
102,42,90,2.1,2025-11-15 02:33:19.754764,"For the first time ever I tried too leave a review for my x-company... However, it never gets published despite using very professional language! I believe glassdoor allows companies to influence what is being said about them on their website and app."
102,91,76,2.1,2025-11-16 06:33:19.754764,So far so good!
102,15,155,3.8,2025-11-17 09:33:19.754764,"Roar of the Broken Bear delivers exactly what Peter Wacht fans expect: fast pacing, sharp world-building, and characters who carry real weight. Wacht blends magic, tension, and emotional stakes in a way that keeps the story moving without wasting a page. The ending left me wanting to read the next book right away!!!"
102,98,265,4.4,2025-11-19 11:33:19.754764,it's good for clearing concepts
102,46,345,5.0,2025-11-20 16:33:19.754764,this application only for paid public this application need subscription for job interview if you have not subscription so you have not received any vacancy
102,72,250,4.7,2025-11-23 21:33:19.754764,I feel so relax after playing this game
102,62,345,5.0,2025-11-26 22:33:19.754764,very good service
103,2,69,2.6,2025-11-06 21:33:19.754764,it was very good l like it but....the thing like the middle was blocking away so l cant draw ngl.but theres the second problem....l cant zoom in so is harder to draw.pls fix it
103,96,71,2.9,2025-11-09 23:33:19.754764,this app is super nice and clear coding
103,33,154,3.4,2025-11-11 01:33:19.754764,amazing app to start or learn trading easy and simple just don't be greedy
103,26,105,3.6,2025-11-13 06:33:19.754764,very helpful for competitive examinations
103,80,146,3.2,2025-11-14 09:33:19.754764,I am loving the experience kop kun ka
103,57,368,5.0,2025-11-17 10:33:19.754764,"precise, preferred/wide ranged subject matter, international news, nonpartisan, more animal kingdom news would be appreciated."
103,29,289,4.7,2025-11-19 15:33:19.754764,hlo grow yr mne grow app se loan lia tha uske withdrawal m 706 rs chor diye the or 15 din deducted ho gye sare ap btaege kyu deducted ho re h jb cycle every month hoga koi customer care help nhi kr rha hai please help
103,82,384,5.0,2025-11-22 17:33:19.754764,Best app for learning python
104,69,32,2.3,2025-11-10 21:33:19.754764,Very good class mam is so nice and encouraging I liked this app it is very good
104,52,111,3.7,2025-11-14 02:33:19.754764,"much needed this application when cost of blood test are so high, thanks for making it affordable all blood test and giving us more discount in package, from sample collection to report availability everything is very smooth, God bless you all the team of pharmeasy"
104,12,126,3.6,2025-11-15 05:33:19.754764,i can't use timer anymore for some reason and a book I had on my account was simply taken away with note boy available and I had an option to re-purchase it.
104,45,175,3.8,2025-11-16 06:33:19.754764,job app se konsi bhi company ne froud keya to job app ki team jaldi hee karvahi karti hai isliye mera pura samrthn job hai app ke sath hai thank you for job hai app team magar mere pese nhi mile muje
104,29,186,3.8,2025-11-18 09:33:19.754764,After log out to account and login with another account all saved indicator all deleted kindly fix it.
104,28,287,4.1,2025-11-20 14:33:19.754764,"The video player should go to landscape mode in full screen and when you press pause, the icons on the screen should go away if you tap the screen once. Overall, nice experience so far."
104,85,166,3.9,2025-11-22 19:33:19.754764,I learned c in this app so good
105,9,76,2.6,2025-11-11 21:33:19.754764,I'm loving it!
105,27,111,3.8,2025-11-13 02:33:19.754764,No option to reset deadline. No notification for new and enrolled courses. Question answer forms are non-responsively horrible. Screen turns off when videos is playing. After enrolling in 600 courses now I have to register for each proctered exam individually on a web browser on a PC. Do you have any idea how long that might take. Horrible registration mechanism. No option to enroll automatically in all listed courses. No option to do mass registration for exam of several courses at once.No cert
105,86,121,3.4,2025-11-16 04:33:19.754764,I wish I had my class room like this!
105,81,136,3.2,2025-11-17 05:33:19.754764,Sundaram Dwivedi
106,81,7,1.6,2025-11-09 21:33:19.754764,sir aap bahut achha padate hai
106,52,37,2.8,2025-11-11 02:33:19.754764,App not working. Fail to reschedule lab test..
106,56,97,2.7,2025-11-13 05:33:19.754764,not perfect durgapur w.b no Searching your app
